<?xml version="1.0" encoding="UTF-8"?>
<personas xmlns:xsi="http://www.w3.org/2001/XMLSchema" xsi:noNamespaceSchemaLocation="./persona.xsd">
    <persona dni="123123">
        <nombre>Andrea Solís</nombre>
        <mayor_de_edad />
        <ciudad>Córdoba</ciudad>
        <rol> cliente </rol>
    </persona>
    <persona dni="234234" formapago="Tarjeta">
        <nombre>Dora la exploradora</nombre>
        <ciudad>Córdoba</ciudad>
       <rol> cliente </rol>
    </persona>
    </personas>
